<?xml version="1.0" encoding="UTF-8"?>
<QUANAN xmlns="http://example.com/quanan"
        xmlns:xsi="http://www.w3.org/2001/XMLSchema-instance"
        xsi:schemaLocation="http://example.com/quanan QuanAn.xsd">
    <NHANVIEN>
        <MANV>NV001</MANV>
        <TenNV>Nguyễn Văn Anh</TenNV>
        <SDT>0123456789</SDT>
        <Diachi>Hà Nội, Việt Nam</Diachi>
        <GioiTinh>Nam</GioiTinh>
        <UserName>admin001</UserName>
        <PassWord>SecureAdmin123</PassWord>
    </NHANVIEN>
    <NHANVIEN>
        <MANV>NV002</MANV>
        <TenNV>Trần Thị Binh</TenNV>
        <SDT>0987654321</SDT>
        <Diachi>TP. Hồ Chí Minh</Diachi>
        <GioiTinh>Nữ</GioiTinh>
        <UserName>staff002</UserName>
        <PassWord>StaffPass4567</PassWord>
    </NHANVIEN>
    <NHANVIEN>
        <MANV>NV003</MANV>
        <TenNV>Lê Văn Cuong</TenNV>
        <SDT>0912345678</SDT>
        <Diachi>Đà Nẵng</Diachi>
        <GioiTinh>Nam</GioiTinh>
        <UserName>manager003</UserName>
        <PassWord>ManagerKey890</PassWord>
    </NHANVIEN>
    <NHANVIEN>
        <MANV>NV004</MANV>
        <TenNV>Phạm Thị Duong</TenNV>
        <SDT>0567890123</SDT>
        <Diachi>Cần Thơ</Diachi>
        <GioiTinh>Nữ</GioiTinh>
        <UserName>waiter004</UserName>
        <PassWord>WaiterSecure101</PassWord>
    </NHANVIEN>
    <NHANVIEN>
        <MANV>NV005</MANV>
        <TenNV>Hoàng Văn Em</TenNV>
        <SDT>0345678901</SDT>
        <Diachi>Huế</Diachi>
        <GioiTinh>Nam</GioiTinh>
        <UserName>chef005</UserName>
        <PassWord>ChefRobust121</PassWord>
    </NHANVIEN>
    <HOADON>
        <SoHD>1</SoHD>
        <NgayLap>2023-10-01</NgayLap>
        <TongTien>500000.0</TongTien>
        <ThamToan>NV001</ThamToan>
        <CTHD>1</CTHD>
        <Soluong>2</Soluong>
    </HOADON>
    <HOADON>
        <SoHD>2</SoHD>
        <NgayLap>2023-10-02</NgayLap>
        <TongTien>750000.0</TongTien>
        <ThamToan>NV002</ThamToan>
        <CTHD>2</CTHD>
        <Soluong>3</Soluong>
    </HOADON>
    <HOADON>
        <SoHD>3</SoHD>
        <NgayLap>2023-10-03</NgayLap>
        <TongTien>300000.0</TongTien>
        <ThamToan>NV003</ThamToan>
        <CTHD>3</CTHD>
        <Soluong>1</Soluong>
    </HOADON>
    <HOADON>
        <SoHD>4</SoHD>
        <NgayLap>2023-10-04</NgayLap>
        <TongTien>1200000.0</TongTien>
        <ThamToan>NV004</ThamToan>
        <CTHD>4</CTHD>
        <Soluong>4</Soluong>
    </HOADON>
    <HOADON>
        <SoHD>5</SoHD>
        <NgayLap>2023-10-05</NgayLap>
        <TongTien>450000.0</TongTien>
        <ThamToan>NV005</ThamToan>
        <CTHD>5</CTHD>
        <Soluong>2</Soluong>
    </HOADON>
    <BAN>
        <TenBan>Bàn VIP 1</TenBan>
        <SoBan>1</SoBan>
    </BAN>
    <BAN>
        <TenBan>Bàn Thường 2</TenBan>
        <SoBan>2</SoBan>
    </BAN>
    <BAN>
        <TenBan>Bàn Gia Đình 3</TenBan>
        <SoBan>3</SoBan>
    </BAN>
    <BAN>
        <TenBan>Bàn Ngoài Trời 4</TenBan>
        <SoBan>4</SoBan>
    </BAN>
    <BAN>
        <TenBan>Bàn Riêng 5</TenBan>
        <SoBan>5</SoBan>
    </BAN>
    <MON>
        <MaMon>MON001</MaMon>
        <TenMon>Phở Bò</TenMon>
        <Gia>50000.0</Gia>
        <HinhAnh>pho_bo.jpg</HinhAnh>
    </MON>
    <MON>
        <MaMon>MON002</MaMon>
        <TenMon>Cơm Tấm</TenMon>
        <Gia>45000.0</Gia>
        <HinhAnh>com_tam.jpg</HinhAnh>
    </MON>
    <MON>
        <MaMon>MON003</MaMon>
        <TenMon>Bún Chả</TenMon>
        <Gia>60000.0</Gia>
        <HinhAnh>bun_cha.jpg</HinhAnh>
    </MON>
    <MON>
        <MaMon>MON004</MaMon>
        <TenMon>Chả Giò</TenMon>
        <Gia>35000.0</Gia>
        <HinhAnh>cha_gio.jpg</HinhAnh>
    </MON>
    <MON>
        <MaMon>MON005</MaMon>
        <TenMon>Nem Nướng</TenMon>
        <Gia>70000.0</Gia>
        <HinhAnh>nem_nuong.jpg</HinhAnh>
    </MON>
</QUANAN>